{
  "id": "GAME-021",
  "category": "Gaming.Timer",
  "nameKey": "tweak.GAME-021.name",
  "descriptionKey": "tweak.GAME-021.desc",
  "sideEffectsKey": "tweak.GAME-021.side",
  "risk": "Expert",
  "evidence": "Disputed",
  "builds": [
    {
      "min": 22000,
      "max": null
    }
  ],
  "editions": [
    "Home",
    "Pro",
    "Enterprise",
    "Education"
  ],
  "scope": "Machine",
  "requiresAdmin": true,
  "requiresReboot": true,
  "detect": {
    "type": "RegistryValueEquals",
    "hive": "HKLM",
    "path": "SYSTEM\\CurrentControlSet\\Control\\Session Manager\\kernel",
    "name": "GlobalTimerResolutionRequests",
    "value": 1
  },
  "apply": [
    {
      "type": "RegistrySetValue",
      "hive": "HKLM",
      "path": "SYSTEM\\CurrentControlSet\\Control\\Session Manager\\kernel",
      "name": "GlobalTimerResolutionRequests",
      "kind": "DWord",
      "value": 1
    }
  ],
  "revert": "restoreFromBackup",
  "sources": [
    "Not documented on Microsoft Learn. The value restores the earlier behavior where a request for a higher timer resolution applies to the whole system (Windows 11 and Server 2022). No measured benefit; can increase power use.",
    "Performance effect not measured, therefore 'Disputed'."
  ],
  "verifiedOn": [],
  "hiddenByDefault": true,
  "impact": "Unclear",
  "impactNote": "tweak.GAME-021.impact",
  "measuredOn": [],
  "plainTitleKey": "tweak.GAME-021.plain.title",
  "plainDescKey": "tweak.GAME-021.plain.desc"
}
