{
  "id": "GAME-009",
  "category": "Gaming.Windowed",
  "nameKey": "tweak.GAME-009.name",
  "descriptionKey": "tweak.GAME-009.desc",
  "sideEffectsKey": "tweak.GAME-009.side",
  "risk": "Safe",
  "evidence": "Disputed",
  "builds": [
    {
      "min": 22621,
      "max": null
    }
  ],
  "editions": [
    "Home",
    "Pro",
    "Enterprise",
    "Education"
  ],
  "scope": "User",
  "requiresAdmin": false,
  "requiresReboot": false,
  "detect": {
    "type": "RegistryListEntryEquals",
    "hive": "HKCU",
    "path": "Software\\Microsoft\\DirectX\\UserGpuPreferences",
    "name": "DirectXUserGlobalSettings",
    "format": "KeyValueSemicolon",
    "key": "SwapEffectUpgradeEnable",
    "value": "1"
  },
  "apply": [
    {
      "type": "RegistryListEntry",
      "hive": "HKCU",
      "path": "Software\\Microsoft\\DirectX\\UserGpuPreferences",
      "name": "DirectXUserGlobalSettings",
      "format": "KeyValueSemicolon",
      "key": "SwapEffectUpgradeEnable",
      "value": "1"
    }
  ],
  "revert": "restoreFromBackup",
  "sources": [
    "Matches the 'Optimizations for windowed games' switch (Settings > System > Display > Graphics, Windows 11 22H2 and later). The registry value is not documented. The app changes only this entry in the shared string (GAME-010 uses the same one).",
    "Performance effect not measured, therefore 'Disputed'."
  ],
  "verifiedOn": [
    {
      "build": 26200,
      "edition": "Home",
      "date": "2026-10-18",
      "method": "Host integration test tests/vm/Invoke-TweakIntegrationTest.ps1, steps 3 to 7 (not a VM)"
    }
  ],
  "hiddenByDefault": true,
  "impact": "Unclear",
  "impactNote": "tweak.GAME-009.impact",
  "measuredOn": [],
  "plainTitleKey": "tweak.GAME-009.plain.title",
  "plainDescKey": "tweak.GAME-009.plain.desc"
}
